Order_ID*,Customer_Name*,Address*,Address2*,Customer_City*,Customer_State*,Pincode*,Mobile*,Phone / Mobile 2,Consignee Email,Product_Name*,Product Quantity*,Product Value*,SKU,Order_Type*,COD_AMOUNT*,Shipment Weight (KG)*,Shipment Length*,Shipment Width*,Shipment Height*,invoice_Value*,Total_Amount*,Hub_Code*
2119522,Karuna,"Ward no. 12, Plot no. 76",Pipra Kalan,,Garhwa,JHARKHAND,8505882483,,,WD WD WC 60TUDCA Bile,1,999,,PP,0,0.5,13,13,13,999,999,HID0084
2119523,SRINIVASA MURTHY .D,Flat no 307,"Laxmi s Exotica, chenchupet,back side of Chava s grand",,Tenali,ANDHRA PRADESH,9618831200,,,WD WD TC 120 R ALPHA,1,999,,PP,0,0.5,13,13,13,999,999,HID0084
2119524,Dipti joshi,"A/101, Amazon, Jayraj nagar, Borivali wesr","Yogi Nagar Marg, jayraj nagar, borivali",,Mumbai,MAHARASHTRA,9820959210,,,WD WD TC 120 R ALPHA,1,999,,PP,0,0.5,13,13,13,999,999,HID0084
2119525,Restore Health CentrePOjaya,"Door no-1/1, Amman nagar",Krishnagiri,,MATHIGIRI,TN,7397707660,,,WD WD 90WC Calcium D-Glucarate,1,999,,PP,0,0.5,13,13,13,999,999,HID0084
2119526,Sanjay sachdeva,"108 B Central Avenue, Sainik Farms",Sainik farms,,NEW DELHI,DELHI,9810975706,,,WD WD TC 120Nattokinas DOOBLE WOOD*4,1,999,,PP,0,0.5,13,13,13,999,999,HID0084
